{
  "$schema": "http://json-schema.org/draft-07/schema#",
  "type": "array",
  "items": {
    "type": "object",
    "required": [
      "id",
      "companyId",
      "country",
      "countryCode",
      "region",
      "city",
      "address",
      "officeType"
    ],
    "additionalProperties": false,
    "properties": {
      "id": {
        "type": "string",
        "pattern": "^[a-z0-9-]+$"
      },
      "companyId": {
        "type": "string",
        "pattern": "^[a-z0-9-]+$"
      },
      "country": {
        "type": "string",
        "minLength": 1,
        "maxLength": 100
      },
      "countryCode": {
        "type": "string",
        "pattern": "^[A-Z]{2}$",
        "description": "ISO 3166-1 alpha-2 country code"
      },
      "region": {
        "type": "string",
        "enum": ["Americas", "Europe", "Asia-Pacific", "Middle East & Africa"]
      },
      "city": {
        "type": "string",
        "minLength": 1,
        "maxLength": 100
      },
      "address": {
        "type": "string",
        "minLength": 1,
        "maxLength": 500
      },
      "postalCode": {
        "type": "string",
        "maxLength": 20
      },
      "officeType": {
        "type": "string",
        "minLength": 1,
        "maxLength": 100
      },
      "latitude": {
        "type": "number",
        "minimum": -90,
        "maximum": 90
      },
      "longitude": {
        "type": "number",
        "minimum": -180,
        "maximum": 180
      },
      "contactUrl": {
        "type": "string",
        "pattern": "^(https?://.*)?$",
        "description": "Optional contact URL"
      },
      "approved": {
        "type": "boolean",
        "description": "If false, office is hidden on the public site until set to true"
      }
    }
  }
}
