[
  {
    "id": "amazon-jp-tok",
    "companyId": "amazon",
    "country": "Japan",
    "countryCode": "JP",
    "region": "Asia-Pacific",
    "city": "Tokyo",
    "address": "Meguro Mark West, 2-21-1 Kamiosaki",
    "postalCode": "141-0021",
    "officeType": "Regional Office",
    "latitude": 35.628,
    "longitude": 139.7164,
    "contactUrl": "https://www.amazon.co.jp"
  },
  {
    "id": "amazon-lu-lux",
    "companyId": "amazon",
    "country": "Luxembourg",
    "countryCode": "LU",
    "region": "Europe",
    "city": "Luxembourg City",
    "address": "38 Avenue John F. Kennedy",
    "postalCode": "L-1855",
    "officeType": "European Headquarters",
    "latitude": 49.6116,
    "longitude": 6.1319,
    "contactUrl": "https://www.aboutamazon.eu"
  },
  {
    "id": "amazon-us-sea",
    "companyId": "amazon",
    "country": "United States",
    "countryCode": "US",
    "region": "Americas",
    "city": "Seattle",
    "address": "410 Terry Ave N",
    "postalCode": "98109",
    "officeType": "Headquarters",
    "latitude": 47.6219,
    "longitude": -122.3367,
    "contactUrl": "https://www.aboutamazon.com/workplace"
  },
  {
    "id": "atlassian-au-sydney",
    "companyId": "atlassian",
    "country": "Australia",
    "countryCode": "AU",
    "region": "Asia-Pacific",
    "city": "Sydney",
    "address": "341 George Street",
    "postalCode": "2000",
    "officeType": "Headquarters",
    "latitude": -33.8688,
    "longitude": 151.2093,
    "contactUrl": "https://www.atlassian.com/company/contact"
  },
  {
    "id": "atlassian-us-san-francisc",
    "companyId": "atlassian",
    "country": "United States",
    "countryCode": "US",
    "region": "Americas",
    "city": "San Francisco",
    "address": "350 Bush Street",
    "postalCode": "94104",
    "officeType": "Regional Office",
    "latitude": 37.7913454,
    "longitude": -122.4032976,
    "contactUrl": "https://www.atlassian.com/company/contact"
  },
  {
    "id": "google-ch-zurich",
    "companyId": "google",
    "country": "Switzerland",
    "countryCode": "CH",
    "region": "Europe",
    "city": "Zurich",
    "address": "Brandschenkestrasse 110",
    "postalCode": "8002",
    "officeType": "Regional Office",
    "latitude": 47.3686,
    "longitude": 8.5392,
    "contactUrl": "https://about.google/contact/"
  },
  {
    "id": "google-de-ham",
    "companyId": "google",
    "country": "Germany",
    "countryCode": "DE",
    "region": "Europe",
    "city": "Hamburg",
    "address": "ABC-Str. 19",
    "postalCode": "20354",
    "officeType": "Regional Office",
    "latitude": 53.5547,
    "longitude": 9.9939,
    "contactUrl": "https://about.google/locations/"
  },
  {
    "id": "google-gb-lon",
    "companyId": "google",
    "country": "United Kingdom",
    "countryCode": "GB",
    "region": "Europe",
    "city": "London",
    "address": "6 Pancras Square",
    "postalCode": "N1C 4AG",
    "officeType": "Regional Office",
    "latitude": 51.5357,
    "longitude": -0.1245,
    "contactUrl": "https://about.google/locations/"
  },
  {
    "id": "google-gb-london",
    "companyId": "google",
    "country": "United Kingdom",
    "countryCode": "GB",
    "region": "Europe",
    "city": "London",
    "address": "1 St Giles High St",
    "postalCode": "WC2H 8AG",
    "officeType": "Regional Office",
    "latitude": 51.5154,
    "longitude": -0.131,
    "contactUrl": "https://about.google/contact/"
  },
  {
    "id": "google-jp-tokyo",
    "companyId": "google",
    "country": "Japan",
    "countryCode": "JP",
    "region": "Asia-Pacific",
    "city": "Tokyo",
    "address": "Roppongi Hills Mori Tower, 6-10-1 Roppongi",
    "postalCode": "106-6140",
    "officeType": "Regional Office",
    "latitude": 35.6586,
    "longitude": 139.7454,
    "contactUrl": "https://about.google/contact/"
  },
  {
    "id": "google-sg-sin",
    "companyId": "google",
    "country": "Singapore",
    "countryCode": "SG",
    "region": "Asia-Pacific",
    "city": "Singapore",
    "address": "70 Pasir Panjang Rd",
    "postalCode": "118499",
    "officeType": "Regional Office",
    "latitude": 1.2761,
    "longitude": 103.8048,
    "contactUrl": "https://about.google/locations/"
  },
  {
    "id": "google-us-mtv",
    "companyId": "google",
    "country": "United States",
    "countryCode": "US",
    "region": "Americas",
    "city": "Mountain View",
    "address": "1600 Amphitheatre Parkway",
    "postalCode": "94043",
    "officeType": "Headquarters",
    "latitude": 37.422,
    "longitude": -122.0841,
    "contactUrl": "https://about.google/locations/"
  },
  {
    "id": "google-us-new-york",
    "companyId": "google",
    "country": "United States",
    "countryCode": "US",
    "region": "Americas",
    "city": "New York",
    "address": "76 9th Avenue",
    "postalCode": "10011",
    "officeType": "Regional Office",
    "latitude": 40.7484,
    "longitude": -74.006,
    "contactUrl": "https://about.google/contact/"
  },
  {
    "id": "google-us-nyc",
    "companyId": "google",
    "country": "United States",
    "countryCode": "US",
    "region": "Americas",
    "city": "New York",
    "address": "111 8th Ave",
    "postalCode": "10011",
    "officeType": "Regional Office",
    "latitude": 40.7411,
    "longitude": -74,
    "contactUrl": "https://about.google/locations/"
  },
  {
    "id": "hsbc-ae-dxb",
    "companyId": "hsbc",
    "country": "United Arab Emirates",
    "countryCode": "AE",
    "region": "Middle East & Africa",
    "city": "Dubai",
    "address": "Dubai International Financial Centre",
    "postalCode": "",
    "officeType": "Regional Office",
    "latitude": 25.2085,
    "longitude": 55.276,
    "contactUrl": "https://www.hsbc.ae/contact/"
  },
  {
    "id": "hsbc-gb-lon",
    "companyId": "hsbc",
    "country": "United Kingdom",
    "countryCode": "GB",
    "region": "Europe",
    "city": "London",
    "address": "8 Canada Square",
    "postalCode": "E14 5HQ",
    "officeType": "Headquarters",
    "latitude": 51.5054,
    "longitude": -0.0235,
    "contactUrl": "https://www.hsbc.com/contact"
  },
  {
    "id": "hsbc-hk-hkg",
    "companyId": "hsbc",
    "country": "Hong Kong",
    "countryCode": "HK",
    "region": "Asia-Pacific",
    "city": "Hong Kong",
    "address": "1 Queen's Road Central",
    "postalCode": "",
    "officeType": "Asia-Pacific Headquarters",
    "latitude": 22.2796,
    "longitude": 114.1577,
    "contactUrl": "https://www.hsbc.com.hk/contact/"
  },
  {
    "id": "hsbc-us-nyc",
    "companyId": "hsbc",
    "country": "United States",
    "countryCode": "US",
    "region": "Americas",
    "city": "New York",
    "address": "452 Fifth Avenue",
    "postalCode": "10018",
    "officeType": "North American Headquarters",
    "latitude": 40.7539,
    "longitude": -73.9838,
    "contactUrl": "https://www.hsbc.com/contact"
  },
  {
    "id": "ibm-br-sao",
    "companyId": "ibm",
    "country": "Brazil",
    "countryCode": "BR",
    "region": "Americas",
    "city": "São Paulo",
    "address": "Av. Pasteur 138-146",
    "postalCode": "22290-240",
    "officeType": "Regional Office",
    "latitude": -22.9532,
    "longitude": -43.1729,
    "contactUrl": "https://www.ibm.com/br-pt/contact"
  },
  {
    "id": "ibm-de-ehr",
    "companyId": "ibm",
    "country": "Germany",
    "countryCode": "DE",
    "region": "Europe",
    "city": "Ehningen",
    "address": "IBM-Allee 1",
    "postalCode": "71139",
    "officeType": "Regional Office",
    "latitude": 48.6542,
    "longitude": 8.9377,
    "contactUrl": "https://www.ibm.com/de-de/contact"
  },
  {
    "id": "ibm-in-ban",
    "companyId": "ibm",
    "country": "India",
    "countryCode": "IN",
    "region": "Asia-Pacific",
    "city": "Bangalore",
    "address": "Manyata Embassy Business Park",
    "postalCode": "560045",
    "officeType": "Development Center",
    "latitude": 13.0456,
    "longitude": 77.6285,
    "contactUrl": "https://www.ibm.com/in-en/contact"
  },
  {
    "id": "ibm-us-arm",
    "companyId": "ibm",
    "country": "United States",
    "countryCode": "US",
    "region": "Americas",
    "city": "Armonk",
    "address": "One Orchard Road",
    "postalCode": "10504",
    "officeType": "Headquarters",
    "latitude": 41.1406,
    "longitude": -73.7172,
    "contactUrl": "https://www.ibm.com/contact"
  },
  {
    "id": "ibm-us-armonk",
    "companyId": "ibm",
    "country": "United States",
    "countryCode": "US",
    "region": "Americas",
    "city": "Armonk",
    "address": "1 New Orchard Road",
    "postalCode": "10504",
    "officeType": "Headquarters",
    "latitude": 41.126,
    "longitude": -73.714,
    "contactUrl": "https://www.ibm.com/contact/us/en/"
  },
  {
    "id": "meta-ie-dub",
    "companyId": "meta",
    "country": "Ireland",
    "countryCode": "IE",
    "region": "Europe",
    "city": "Dublin",
    "address": "4 Grand Canal Square",
    "postalCode": "D02 X525",
    "officeType": "European Headquarters",
    "latitude": 53.3404,
    "longitude": -6.2374,
    "contactUrl": "https://about.meta.com/offices/"
  },
  {
    "id": "meta-sg-sin",
    "companyId": "meta",
    "country": "Singapore",
    "countryCode": "SG",
    "region": "Asia-Pacific",
    "city": "Singapore",
    "address": "9 Straits View, Marina One",
    "postalCode": "018937",
    "officeType": "Regional Office",
    "latitude": 1.2784,
    "longitude": 103.8616,
    "contactUrl": "https://about.meta.com/offices/"
  },
  {
    "id": "meta-us-mpk",
    "companyId": "meta",
    "country": "United States",
    "countryCode": "US",
    "region": "Americas",
    "city": "Menlo Park",
    "address": "1 Hacker Way",
    "postalCode": "94025",
    "officeType": "Headquarters",
    "latitude": 37.4845,
    "longitude": -122.1481,
    "contactUrl": "https://about.meta.com/offices/"
  },
  {
    "id": "microsoft-de-ber",
    "companyId": "microsoft",
    "country": "Germany",
    "countryCode": "DE",
    "region": "Europe",
    "city": "Berlin",
    "address": "Unter den Linden 17",
    "postalCode": "10117",